drop table if exists t1,t2,t3,t11,t12;
CREATE TABLE t1 (a tinyint(3), b tinyint(5));
INSERT INTO t1 VALUES (1,1);
INSERT INTO t1 VALUES (1,2);
INSERT INTO t1 VALUES (1,3);
DELETE from t1 where a=1 limit 1;
DELETE from t1 where a=1;
INSERT INTO t1 VALUES (1,1);
DELETE from t1;
INSERT INTO t1 VALUES (1,2);
DELETE from t1;
INSERT INTO t1 VALUES (1,2);
SET AUTOCOMMIT=0;
DELETE from t1;
SET AUTOCOMMIT=1;
drop table t1;
create table t1 (
a bigint not null,
b bigint not null default 0,
c bigint not null default 0,
d bigint not null default 0,
e bigint not null default 0,
f bigint not null default 0,
g bigint not null default 0,
h bigint not null default 0,
i bigint not null default 0,
j bigint not null default 0,
primary key (a,b,c,d,e,f,g,h,i,j));
insert into t1 (a) values (2),(4),(6),(8),(10),(12),(14),(16),(18),(20),(22),(24),(26),(23);
delete from t1 where a=26;
drop table t1;
create table t1 (
a bigint not null,
b bigint not null default 0,
c bigint not null default 0,
d bigint not null default 0,
e bigint not null default 0,
f bigint not null default 0,
g bigint not null default 0,
h bigint not null default 0,
i bigint not null default 0,
j bigint not null default 0,
primary key (a,b,c,d,e,f,g,h,i,j));
insert into t1 (a) values (2),(4),(6),(8),(10),(12),(14),(16),(18),(20),(22),(24),(26),(23),(27);
delete from t1 where a=27;
drop table t1;
CREATE TABLE `t1` (
`i` int(10) NOT NULL default '0',
`i2` int(10) NOT NULL default '0',
PRIMARY KEY  (`i`)
);
drop table t1;
CREATE TABLE t1 (
bool     char(0) default NULL,
not_null varchar(20) binary NOT NULL default '',
misc     integer not null,
PRIMARY KEY  (not_null)
);
INSERT INTO t1 VALUES (NULL,'a',4), (NULL,'b',5), (NULL,'c',6), (NULL,'d',7);
select * from t1 where misc > 5 and bool is null;
bool	not_null	misc
NULL	c	6
NULL	d	7
delete   from t1 where misc > 5 and bool is null;
select * from t1 where misc > 5 and bool is null;
bool	not_null	misc
select count(*) from t1;
count(*)
2
delete from t1 where 1 > 2;
select count(*) from t1;
count(*)
2
delete from t1 where 3 > 2;
select count(*) from t1;
count(*)
0
drop table t1;
create table t11 (a int NOT NULL, b int, primary key (a));
create table t12 (a int NOT NULL, b int, primary key (a));
create table t2 (a int NOT NULL, b int, primary key (a));
insert into t11 values (0, 10),(1, 11),(2, 12);
insert into t12 values (33, 10),(0, 11),(2, 12);
insert into t2 values (1, 21),(2, 12),(3, 23);
select * from t11;
a	b
0	10
1	11
2	12
select * from t12;
a	b
0	11
2	12
33	10
select * from t2;
a	b
1	21
2	12
3	23
select * from t11;
a	b
0	10
1	11
2	12
select * from t12;
a	b
0	11
2	12
33	10
select * from t11;
a	b
0	10
1	11
2	12
select * from t12;
a	b
0	11
2	12
33	10
insert into t11 values (12, 12);
delete from t11 where t11.b <> (select b from t2 where t11.a < t2.a);
ERROR 21000: Subquery returns more than 1 row
select * from t11;
a	b
0	10
1	11
2	12
12	12
delete from t11 where t11.b <> (select b from t2 where t11.a < t2.a);
ERROR 21000: Subquery returns more than 1 row
delete from t11 where t11.b <> (select b from t2 where t11.a < t2.a limit 1);
select * from t11;
a	b
12	12
drop table t11, t12, t2;
create table t1 (a int, b int, unique key (a), key (b));
insert into t1 values (3, 3), (7, 7);
delete from t1 where a = 3;
select * from t1;
a	b
7	7
drop table t1;
CREATE TABLE t1 ( a int PRIMARY KEY );
DELETE FROM t1 WHERE t1.a > 0 ORDER BY t1.a;
INSERT INTO t1 VALUES (0),(1),(2);
DELETE FROM t1 WHERE t1.a > 0 ORDER BY t1.a LIMIT 1;
SELECT * FROM t1;
a
0
2
DROP TABLE t1;
create table t1(f1 int primary key);
insert into t1 values (4),(3),(1),(2);
delete from t1 where (@a:= f1) order by f1 limit 1;
select @a;
@a
1
drop table t1;
CREATE TABLE t1 (
`date` date ,
`time` time ,
`seq` int(10) unsigned NOT NULL auto_increment,
PRIMARY KEY  (`seq`),
KEY `seq` (`seq`),
KEY `time` (`time`),
KEY `date` (`date`)
);
DELETE FROM t1 ORDER BY date ASC, time ASC LIMIT 1;
drop table t1;
End of 4.1 tests
CREATE TABLE t1 (a int not null,b int not null);
CREATE TABLE t2 (a int not null, b int not null, primary key (a,b));
CREATE TABLE t3 (a int not null, b int not null, primary key (a,b));
insert into t1 values (1,1),(2,1),(1,3);
insert into t2 values (1,1),(2,2),(3,3);
insert into t3 values (1,1),(2,1),(1,3);
select * from t1,t2,t3 where t1.a=t2.a AND t2.b=t3.a and t1.b=t3.b order by t1.a, t1.b;
a	b	a	b	a	b
1	1	1	1	1	1
1	3	1	1	1	3
2	1	2	2	2	1
select * from t3;
a	b
1	1
1	3
2	1
drop table t1,t2,t3;
create table t1(a date not null);
insert into t1 values (0);
select * from t1 where a is null;
a
0000-00-00
delete from t1 where a is null;
select count(*) from t1;
count(*)
0
drop table t1;
CREATE TABLE t1 (a INT);
INSERT INTO t1 VALUES (1);
DELETE FROM t1 ORDER BY x;
ERROR 42S22: Unknown column 'x' in 'order clause'
DELETE FROM t1 ORDER BY t2.x;
ERROR 42S22: Unknown column 't2.x' in 'order clause'
DROP TABLE t1;
CREATE TABLE t1 (
a INT
);
CREATE TABLE t2 (
a INT
);
drop database if exists db1;
CREATE DATABASE db1;
CREATE TABLE db1.t1 (
a INT
);
drop database if exists db2;
CREATE DATABASE db2;
CREATE TABLE db2.t1 (
a INT
);
DROP TABLE t1, t2;
DROP DATABASE db1;
DROP DATABASE db2;
#
# Bug #49552 : sql_buffer_result cause crash + not found records
#   in multitable delete/subquery
#
End of 5.0 tests
DROP DATABASE IF EXISTS db1;
DROP DATABASE IF EXISTS db2;
DROP DATABASE IF EXISTS db3;
DROP DATABASE IF EXISTS db4;
DROP TABLE IF EXISTS t1, t2;
USE test;
CREATE DATABASE db1;
CREATE DATABASE db2;
CREATE TABLE db1.t1 (a INT, b INT);
INSERT INTO db1.t1 VALUES (1,1),(2,2),(3,3);
CREATE DATABASE db3;
USE db3;
DROP DATABASE db3;
SELECT * FROM t1;
ERROR 3D000: No database selected
USE test;
DROP DATABASE db1;
DROP DATABASE db2;
DROP TABLE if exists t1, t2;
#
# Bug#46958: Assertion in Diagnostics_area::set_ok_status, trigger,
# merge table
#
CREATE TABLE t1 ( a INT );
CREATE TABLE t2 ( a INT );
CREATE TABLE t3 ( a INT );
INSERT INTO t1 VALUES (1), (2);
INSERT INTO t2 VALUES (1), (2);
INSERT INTO t3 VALUES (1), (2);
SELECT * FROM t1;
a
1
2
SELECT * FROM t2;
a
1
2
SELECT * FROM t3;
a
1
2
DROP TABLE t1, t2, t3;
CREATE TABLE t1 ( a INT );
CREATE TABLE t2 ( a INT );
CREATE TABLE t3 ( a INT );
INSERT INTO t1 VALUES (1), (2);
INSERT INTO t2 VALUES (1), (2);
INSERT INTO t3 VALUES (1), (2);
SELECT * FROM t1;
a
1
2
SELECT * FROM t2;
a
1
2
SELECT * FROM t3;
a
1
2
DROP TABLE t1, t2, t3;
#
# Bug #46425 crash in Diagnostics_area::set_ok_status,
#            empty statement, DELETE IGNORE
#
CREATE table t1 (i INTEGER);
INSERT INTO t1 VALUES (1);
DROP TABLE t1;
#
# Bug #53450: Crash/assertion
#    virtual int ha_myisam::index_first(uchar*)) at assert.c:81
#
CREATE TABLE t1 (a INT,    b INT,    c INT,
INDEX(a), INDEX(b), INDEX(c));
INSERT INTO t1 VALUES (1,2,3), (4,5,6), (7,8,9);
DELETE FROM t1 WHERE a = 10 OR b = 20 ORDER BY c LIMIT 1;
DROP TABLE t1;
#
# Bug #53034: Multiple-table DELETE statements not accepting
#             Access compatibility syntax
#
CREATE TABLE t1 (id INT);
CREATE TABLE t2 LIKE t1;
CREATE TABLE t3 LIKE t1;
DROP TABLE t1, t2, t3;
End of 5.1 tests
#
# Bug#51099 Assertion in mysql_multi_delete_prepare()
#
DROP TABLE IF EXISTS t1, t2;
DROP VIEW IF EXISTS v1, v2;
CREATE TABLE t1(a INT);
CREATE TABLE t2(b INT);
CREATE VIEW v1 AS SELECT a, b FROM t1, t2;
CREATE VIEW v2 AS SELECT a FROM v1;
DROP VIEW v2, v1;
DROP TABLE t1, t2;
#
# Bug#58709 assert in mysql_execute_command
#
DROP TABLE IF EXISTS t2, t1;
CREATE TABLE t1 (i INT PRIMARY KEY);
INSERT INTO t1 VALUES (1);
DROP TABLE t1;
