drop table if exists t1;
create table t1 (a int, b int, primary key (a));
insert into t1(a,b) values(10,NULL),(1,1),(2,1),(3,1),(4,1);
delete from t1 where a in (1,2,3,4);
select * from t1;
a	b
10	NULL
replace into t1(a,b) values(11,NULL),(1,1),(2,1),(3,1),(4,1);
delete from t1 where a in (NULL,1) or a in (2,3,4);
select * from t1;
a	b
10	NULL
11	NULL
replace into t1(a,b) values(12,NULL),(1,1),(2,1),(3,1),(4,1);
delete from t1 where a in (1) or a in (2) or a in (3,4);
select * from t1;
a	b
10	NULL
11	NULL
12	NULL
replace into t1(a,b) values(13,NULL),(1,1),(2,1),(3,1),(4,1);
delete from t1 where a in (NULL,1,3) and a in (1,2,3,4);
select * from t1;
a	b
2	1
4	1
10	NULL
11	NULL
12	NULL
13	NULL
replace into t1(a,b) values(14,NULL),(1,1),(2,1),(3,1),(4,1);
delete from t1 where a in (1,2,3,4) and b in (1,2,3,4);
select * from t1;
a	b
10	NULL
11	NULL
12	NULL
13	NULL
14	NULL
replace into t1(a,b) values(15,NULL),(1,1),(2,1),(3,1),(4,1);
delete from t1 where b in (1,2,3,4) and a in (1,2,3,4);
select * from t1;
a	b
10	NULL
11	NULL
12	NULL
13	NULL
14	NULL
15	NULL
replace into t1(a,b) values(16,NULL),(1,1),(2,1),(3,1),(4,1);
delete from t1 where b in (1,2,3);
select * from t1;
a	b
10	NULL
11	NULL
12	NULL
13	NULL
14	NULL
15	NULL
16	NULL
replace into t1(a,b) values(17,NULL),(1,1),(2,1),(3,1),(4,1);
delete from t1 where a in (1,2,3) or b in (1,2,3);
select * from t1;
a	b
10	NULL
11	NULL
12	NULL
13	NULL
14	NULL
15	NULL
16	NULL
17	NULL
replace into t1(a,b) values(18,NULL),(1,1),(2,1),(3,1),(4,1);
delete from t1 where b in (1,2,3) or a in (1,2,3);
select * from t1;
a	b
10	NULL
11	NULL
12	NULL
13	NULL
14	NULL
15	NULL
16	NULL
17	NULL
18	NULL
replace into t1(a,b) values(19,NULL),(1,1),(2,1),(3,1),(4,1);
delete from t1 where a in (NULL,1,3) and a in (2,4);
select * from t1;
a	b
1	1
2	1
3	1
4	1
10	NULL
11	NULL
12	NULL
13	NULL
14	NULL
15	NULL
16	NULL
17	NULL
18	NULL
19	NULL
drop table t1;
create table t1(a int, b varchar(128), c  timestamp(6) default "2012-01-01 12:00:00", d int, primary key(a,b,c));
replace into t1(a,b,c,d) values(1,'1','2014-02-17',NULL),(2,'2','2014-02-17',NULL),(3,'3','2014-02-17',NULL);
delete from t1 where (a,b,c) in ((1,'1','2014-02-17'));
delete from t1 where (a,b,c) in ((2,'2','2014-02-17'),(3,'3','2014-02-17'));
select * from t1;
a	b	c	d
replace into t1(a,b,c,d) values(1,'1','2014-02-17',NULL),(2,'2','2014-02-17',NULL),(3,'3','2014-02-17',NULL);
delete from t1 where (a,b,c) in ((1,'1','2014-02-17'),(2,'2','2014-02-17'),(3,'3','2014-02-17'));
select * from t1;
a	b	c	d
replace into t1(a,b,c,d) values(1,'1','2014-02-17',NULL),(2,'2','2014-02-17',NULL),(3,'3','2014-02-17',NULL);
delete from t1 where (a,b,c) in ((NULL,NULL,NULL),(1,'1','2014-02-17'),(2,'2','2014-02-17'),(4,'4','2014-02-17'));
select * from t1;
a	b	c	d
3	3	2014-02-17 00:00:00.000000	NULL
replace into t1(a,b,c,d) values(1,'1','2014-02-17',NULL),(2,'2','2014-02-17',2),(3,'3','2014-02-17',2);
delete from t1 where (a,b,c,d) in ((1,'1','2014-02-17',NULL),(2,'2','2014-02-17',2),(3,'3','2014-02-17',2));
select * from t1;
a	b	c	d
1	1	2014-02-17 00:00:00.000000	NULL
replace into t1(a,b,c,d) values(1,'1','2014-02-17',1),(2,'2','2014-02-17',1),(3,'3','2014-02-17',1);
delete from t1 where (a,b,c) in ((1,'1','2014-02-17'),(2,'2','2014-02-17'),(3,'3','2014-02-17')) and d in (2,2);
select * from t1;
a	b	c	d
1	1	2014-02-17 00:00:00.000000	1
2	2	2014-02-17 00:00:00.000000	1
3	3	2014-02-17 00:00:00.000000	1
delete from t1 where (a,b,c) in ((1,'1','2014-02-17'),(2,'2','2014-02-17'),(3,'3','2014-02-17')) and d in (1,2);
select * from t1;
a	b	c	d
replace into t1(a,b,c,d) values(1,'1','2014-02-17',1),(2,'2','2014-02-17',1),(3,'3','2014-02-17',1);
delete from t1 where (a,b,c) in ((1,'1','2014-02-17')) or (a,b,c) in ((2,'2','2014-02-17'),(3,'3','2014-02-17')) and d in (1);
select * from t1;
a	b	c	d
replace into t1(a,b,c,d) values(1,'1','2014-02-17',1),(2,'2','2014-02-17',1),(3,'3','2014-02-17',1);
delete from t1 where (a,b,c) in ((1,'1','2014-02-17'),(2,'2','2014-02-17')) and (a,b,c) in ((2,'2','2014-02-17'),(3,'3','2014-02-17')) and d>0;
select * from t1;
a	b	c	d
1	1	2014-02-17 00:00:00.000000	1
3	3	2014-02-17 00:00:00.000000	1
replace into t1(a,b,c,d) values(1,'1','2014-02-17',1),(2,'2','2014-02-17',1),(3,'3','2014-02-17',1);
delete from t1 where (a) in ((1),(2));
select * from t1;
a	b	c	d
3	3	2014-02-17 00:00:00.000000	1
delete from t1 where (a,b) in ((3,'3'),(2,'2'));
select * from t1;
a	b	c	d
replace into t1(a,b,c,d) values(1,'1','2014-02-17',1),(2,'2','2014-02-17',1),(3,'3','2014-02-17',1);
delete from t1 where (b,c,a) in (('1','2014-02-17',1),('2','2014-02-17',2));
select * from t1;
a	b	c	d
3	3	2014-02-17 00:00:00.000000	1
replace into t1(a,b,c,d) values(1,'1','2014-02-17',1),(2,'2','2014-02-17',1),(3,'3','2014-02-17',1);
delete from t1 where (a,b,c) in ((1,'1','2014-02-17'),(2,'2','2014-02-17')) or (b,c) in (('2','2014-02-17'),('3','2014-02-17'));
select * from t1;
a	b	c	d
drop table t1;
