DROP TABLE IF EXISTS t1;
CREATE TABLE t1(c1 TINYINT NOT NULL);
INSERT INTO t1 (c1) VALUES(0),(1),(2),(3),(4),(5),(6),(7),(8),(9);
UPDATE   t1 SET c1 = -1 WHERE c1 >= 5;
SELECT * FROM t1 ORDER BY c1;
c1
-1
-1
-1
-1
-1
0
1
2
3
4
UPDATE   t1 SET c1 = -10;
SELECT * FROM t1 ORDER BY c1;
c1
-10
-10
-10
-10
-10
-10
-10
-10
-10
-10
DROP TABLE t1;
CREATE TABLE t1(c1 SMALLINT NOT NULL);
INSERT INTO t1 (c1) VALUES(0),(1),(2),(3),(4),(5),(6),(7),(8),(9);
UPDATE   t1 SET c1 = -1 WHERE c1 >= 5;
SELECT * FROM t1 ORDER BY c1;
c1
-1
-1
-1
-1
-1
0
1
2
3
4
UPDATE   t1 SET c1 = -10;
SELECT * FROM t1 ORDER BY c1;
c1
-10
-10
-10
-10
-10
-10
-10
-10
-10
-10
DROP TABLE t1;
CREATE TABLE t1(c1 MEDIUMINT NOT NULL);
INSERT INTO t1 (c1) VALUES(0),(1),(2),(3),(4),(5),(6),(7),(8),(9);
UPDATE   t1 SET c1 = -1 WHERE c1 >= 5;
SELECT * FROM t1 ORDER BY c1;
c1
-1
-1
-1
-1
-1
0
1
2
3
4
UPDATE   t1 SET c1 = -10;
SELECT * FROM t1 ORDER BY c1;
c1
-10
-10
-10
-10
-10
-10
-10
-10
-10
-10
DROP TABLE t1;
CREATE TABLE t1(c1 INT NOT NULL);
INSERT INTO t1 (c1) VALUES(0),(1),(2),(3),(4),(5),(6),(7),(8),(9);
UPDATE   t1 SET c1 = -1 WHERE c1 >= 5;
SELECT * FROM t1 ORDER BY c1;
c1
-1
-1
-1
-1
-1
0
1
2
3
4
UPDATE   t1 SET c1 = -10;
SELECT * FROM t1 ORDER BY c1;
c1
-10
-10
-10
-10
-10
-10
-10
-10
-10
-10
DROP TABLE t1;
CREATE TABLE t1(c1 INTEGER NOT NULL);
INSERT INTO t1 (c1) VALUES(0),(1),(2),(3),(4),(5),(6),(7),(8),(9);
UPDATE   t1 SET c1 = -1 WHERE c1 >= 5;
SELECT * FROM t1 ORDER BY c1;
c1
-1
-1
-1
-1
-1
0
1
2
3
4
UPDATE   t1 SET c1 = -10;
SELECT * FROM t1 ORDER BY c1;
c1
-10
-10
-10
-10
-10
-10
-10
-10
-10
-10
DROP TABLE t1;
CREATE TABLE t1(c1 BIGINT NOT NULL);
INSERT INTO t1 (c1) VALUES(0),(1),(2),(3),(4),(5),(6),(7),(8),(9);
UPDATE   t1 SET c1 = -1 WHERE c1 >= 5;
SELECT * FROM t1 ORDER BY c1;
c1
-1
-1
-1
-1
-1
0
1
2
3
4
UPDATE   t1 SET c1 = -10;
SELECT * FROM t1 ORDER BY c1;
c1
-10
-10
-10
-10
-10
-10
-10
-10
-10
-10
drop table t1;
create table t1(a bigint not null);
insert into t1 values(1);
update ignore t1 set a='a' where a=1;
select * from t1;
a
0
insert into t1 values(2), (3), (4);
update ignore t1 set a='a' where a>0;
select * from t1;
a
0
0
0
0
delete from t1;
update ignore t1 set a=null where a>0;
select * from t1;
a
drop table t1;
create table t1(a varchar(2) primary key);
insert into t1 values('aa');
update ignore t1 set a='aaaaa' where a='aa';
select * from t1;
a
aa
update ignore t1 set a=null where a='aa';
Warnings:
Warning	1048	Column 'a' cannot be null
select * from t1;
a

DROP TABLE t1;
CREATE TABLE t1(c1 TINYINT NOT NULL);
INSERT INTO t1 (c1) VALUES(0),(1),(2),(3),(4),(5),(6),(7),(8),(9);
UPDATE IGNORE t1 SET c1 = -1 WHERE c1 >= 5;
SELECT * FROM t1 ORDER BY c1;
c1
-1
-1
-1
-1
-1
0
1
2
3
4
UPDATE IGNORE t1 SET c1 = -10;
SELECT * FROM t1 ORDER BY c1;
c1
-10
-10
-10
-10
-10
-10
-10
-10
-10
-10
DROP TABLE t1;
CREATE TABLE t1(c1 SMALLINT NOT NULL);
INSERT INTO t1 (c1) VALUES(0),(1),(2),(3),(4),(5),(6),(7),(8),(9);
UPDATE IGNORE t1 SET c1 = -1 WHERE c1 >= 5;
SELECT * FROM t1 ORDER BY c1;
c1
-1
-1
-1
-1
-1
0
1
2
3
4
UPDATE IGNORE t1 SET c1 = -10;
SELECT * FROM t1 ORDER BY c1;
c1
-10
-10
-10
-10
-10
-10
-10
-10
-10
-10
DROP TABLE t1;
CREATE TABLE t1(c1 MEDIUMINT NOT NULL);
INSERT INTO t1 (c1) VALUES(0),(1),(2),(3),(4),(5),(6),(7),(8),(9);
UPDATE IGNORE t1 SET c1 = -1 WHERE c1 >= 5;
SELECT * FROM t1 ORDER BY c1;
c1
-1
-1
-1
-1
-1
0
1
2
3
4
UPDATE IGNORE t1 SET c1 = -10;
SELECT * FROM t1 ORDER BY c1;
c1
-10
-10
-10
-10
-10
-10
-10
-10
-10
-10
DROP TABLE t1;
CREATE TABLE t1(c1 INT NOT NULL);
INSERT INTO t1 (c1) VALUES(0),(1),(2),(3),(4),(5),(6),(7),(8),(9);
UPDATE IGNORE t1 SET c1 = -1 WHERE c1 >= 5;
SELECT * FROM t1 ORDER BY c1;
c1
-1
-1
-1
-1
-1
0
1
2
3
4
UPDATE IGNORE t1 SET c1 = -10;
SELECT * FROM t1 ORDER BY c1;
c1
-10
-10
-10
-10
-10
-10
-10
-10
-10
-10
DROP TABLE t1;
CREATE TABLE t1(c1 INTEGER NOT NULL);
INSERT INTO t1 (c1) VALUES(0),(1),(2),(3),(4),(5),(6),(7),(8),(9);
UPDATE IGNORE t1 SET c1 = -1 WHERE c1 >= 5;
SELECT * FROM t1 ORDER BY c1;
c1
-1
-1
-1
-1
-1
0
1
2
3
4
UPDATE IGNORE t1 SET c1 = -10;
SELECT * FROM t1 ORDER BY c1;
c1
-10
-10
-10
-10
-10
-10
-10
-10
-10
-10
DROP TABLE t1;
CREATE TABLE t1(c1 BIGINT NOT NULL);
INSERT INTO t1 (c1) VALUES(0),(1),(2),(3),(4),(5),(6),(7),(8),(9);
UPDATE IGNORE t1 SET c1 = -1 WHERE c1 >= 5;
SELECT * FROM t1 ORDER BY c1;
c1
-1
-1
-1
-1
-1
0
1
2
3
4
UPDATE IGNORE t1 SET c1 = -10;
SELECT * FROM t1 ORDER BY c1;
c1
-10
-10
-10
-10
-10
-10
-10
-10
-10
-10
DROP TABLE t1;
