drop table if exists t1;
create table t1 (a int, b int, primary key (a));
insert into t1(a,b) values(0,NULL),(1,1),(2,1),(3,1),(4,1);
update t1 set b=NULL where a in(1);
update t1 set b=NULL where a in(2,3,4);
select * from t1;
a	b
0	NULL
1	NULL
2	NULL
3	NULL
4	NULL
update t1 set b=a+1 where a in (NULL,1,2,3,4);
select * from t1;
a	b
0	NULL
1	2
2	3
3	4
4	5
update t1 set b=NULL where a in (5,6,7);
select * from t1;
a	b
0	NULL
1	2
2	3
3	4
4	5
update t1 set b=1 where a in (0,NULL,1,2,3,4,5);
select * from t1;
a	b
0	1
1	1
2	1
3	1
4	1
update t1 set b=2 where a in (1,2,3,4) and b=1;
select * from t1;
a	b
0	1
1	2
2	2
3	2
4	2
update t1 set b=3 where a in (1,2,3,4) and b in (1,2,3,4);
select * from t1;
a	b
0	1
1	3
2	3
3	3
4	3
update t1 set b=4 where a in (NULL,1,2,3,4) and a in (NULL);
update t1 set b=5 where a in (1,2,3,4) and a in (1);
update t1 set b=6 where a in (1,2,3,4) and a in (2,3,4);
select * from t1;
a	b
0	1
1	5
2	6
3	6
4	6
update t1 set b=7 where a in (NULL,1) or a in (2,3) or a in (4);
select * from t1;
a	b
0	1
1	7
2	7
3	7
4	7
update t1 set b=8 where b in (6,7,8) and a in (NULL,1,2,3,4);
select * from t1;
a	b
0	1
1	8
2	8
3	8
4	8
update t1 set b=9 where b in (8) and a in (1,2,3,4);
select * from t1;
a	b
0	1
1	9
2	9
3	9
4	9
update t1 set b=1 where a in (NULL,1,2,3,4);
update t1 set a=a+1 where a in (1,2,3,4);
ERROR 23000: Duplicate entry '2' for key 'PRIMARY'
update t1 set b=2 where b in (1);
select * from t1;
a	b
0	2
1	2
2	2
3	2
4	2
update t1 set b=3 where b in (1,2,3,4,5,6,7) or a in (1);
select * from t1;
a	b
0	3
1	3
2	3
3	3
4	3
update t1 set b=4 where a in (NULL,1,2,3,4) or b in (1,2,3,4,5,6,7);
select * from t1;
a	b
0	4
1	4
2	4
3	4
4	4
update t1 set b=5 where a in(1,2) and a in (3,4);
select * from t1;
a	b
0	4
1	4
2	4
3	4
4	4
drop table t1;
create table t1(a int, b int, c int, d int, primary key(a,b));
insert into t1(a,b,c,d) values(4,4,NULL,NULL),(1,1,1,1),(2,2,1,1),(3,3,1,1);
update t1 set c=c+1, d=d+1 where (a,b) in ((NULL,NULL));
update t1 set c=c+1, d=d+1 where (a,b) in ((1,1));
update t1 set c=c+1, d=d+1 where (a,b) in ((2,2),(3,3));
select * from t1;
a	b	c	d
1	1	2	2
2	2	2	2
3	3	2	2
4	4	NULL	NULL
update t1 set c=3, d=3 where (a,b) in ((1,1),(2,2),(3,3));
select * from t1;
a	b	c	d
1	1	3	3
2	2	3	3
3	3	3	3
4	4	NULL	NULL
update t1 set c=4, d=4 where (a,b) in ((NULL,NULL),(0,0),(1,1),(2,2),(3,3),(4,4));
select * from t1;
a	b	c	d
1	1	4	4
2	2	4	4
3	3	4	4
4	4	4	4
update t1 set c=1, d=1 where (a,b) in ((NULL,NULL),(1,1),(2,2),(3,3));
update t1 set c=2, d=2 where (a,b,c) in ((NULL,NULL,1),(1,1,1));
select * from t1;
a	b	c	d
1	1	2	2
2	2	1	1
3	3	1	1
4	4	4	4
update t1 set c=1, d=1 where (a,b) in ((NULL,NULL),(1,1),(2,2),(3,3));
update t1 set c=2, d=2 where (a,b,c,d) in ((NULL,NULL,1,1),(0,0,1,1),(1,1,1,1),(2,2,1,1),(3,3,1,1),(4,4,1,1));
select * from t1;
a	b	c	d
1	1	2	2
2	2	2	2
3	3	2	2
4	4	4	4
update t1 set c=1, d=1 where (a,b) in ((NULL,NULL),(1,1),(2,2),(3,3));
update t1 set c=2, d=2 where (a,b) in ((NULL,NULL),(1,1),(2,2),(3,3)) and (c,d) in ((2,2));
update t1 set c=3, d=3 where (a,b) in ((NULL,NULL),(1,1),(2,2),(3,3)) and (c,d) in ((1,1));
select * from t1;
a	b	c	d
1	1	3	3
2	2	3	3
3	3	3	3
4	4	4	4
update t1 set c=1, d=1 where (a,b) in ((NULL,NULL),(1,1),(2,2),(3,3));
update t1 set c=2, d=2 where (c,d) in ((1,1),(2,2)) and (a,b) in ((1,1),(2,2),(3,3));
select * from t1;
a	b	c	d
1	1	2	2
2	2	2	2
3	3	2	2
4	4	4	4
update t1 set c=1, d=1 where (a,b) in ((1,1),(2,2),(3,3));
update t1 set c=2, d=2 where (a,b) in ((1,1)) and (a,b) in ((1,1),(2,2),(3,3));
select * from t1;
a	b	c	d
1	1	2	2
2	2	1	1
3	3	1	1
4	4	4	4
update t1 set c=1, d=1 where (a,b) in ((1,1),(2,2),(3,3));
update t1 set c=2, d=2 where (a,b) in ((1,1)) or (a,b) in ((2,2),(3,3));
select * from t1;
a	b	c	d
1	1	2	2
2	2	2	2
3	3	2	2
4	4	4	4
update t1 set c=1, d=1 where (a,b) in ((1,1),(2,2),(3,3));
update t1 set c=2, d=2 where (a,b) in ((1,1)) or (a,b,c) in ((2,2,1)) or (a,b,c,d) in ((3,3,1,1));
select * from t1;
a	b	c	d
1	1	2	2
2	2	2	2
3	3	2	2
4	4	4	4
update t1 set c=1, d=1 where (a,b) in ((NULL,NULL),(1,1),(2,2),(3,3));
update t1 set c=2, d=2 where a in (1,2);
select * from t1;
a	b	c	d
1	1	2	2
2	2	2	2
3	3	1	1
4	4	4	4
update t1 set c=3, d=3 where b in (1,2);
select * from t1;
a	b	c	d
1	1	3	3
2	2	3	3
3	3	1	1
4	4	4	4
update t1 set c=4, d=4 where (b,a) in ((NULL,NULL),(0,0),(1,1),(2,2),(3,3),(4,4));
select * from t1;
a	b	c	d
1	1	4	4
2	2	4	4
3	3	4	4
4	4	4	4
update t1 set c=1, d=1 where (a,b) in ((NULL,NULL),(1,1),(2,2),(3,3));
update t1 set c=2, d=2 where (a,c) in ((1,1),(2,1));
update t1 set c=3, d=3 where (c,a,b) in ((1,3,3),(1,4,4));
select * from t1;
a	b	c	d
1	1	2	2
2	2	2	2
3	3	3	3
4	4	4	4
update t1 set c=1, d=1 where (a,b) in ((NULL,NULL),(1,1),(2,2),(3,3));
update t1 set c=2, d=2 where (b,a,d) in ((1,1,1),(2,2,1));
select * from t1;
a	b	c	d
1	1	2	2
2	2	2	2
3	3	1	1
4	4	4	4
update t1 set c=1, d=1 where (a,b) in ((NULL,NULL),(1,1),(2,2),(3,3)) or (c,d) in ((1,1));
select * from t1;
a	b	c	d
1	1	1	1
2	2	1	1
3	3	1	1
4	4	4	4
update t1 set c=2, d=2 where (c,d) in ((NULL,NULL),(1,1),(2,2),(3,3)) or (a,b) in ((1,1));
select * from t1;
a	b	c	d
1	1	2	2
2	2	2	2
3	3	2	2
4	4	4	4
update t1 set c=3, d=3 where (a,b) in ((1,1)) and (a,b) in ((2,2),(3,3));
select * from t1;
a	b	c	d
1	1	2	2
2	2	2	2
3	3	2	2
4	4	4	4
update t1 set c=4, d=4 where (a,b) in ((1,1),(2,2)) and (b,a) in ((2,2));
select * from t1;
a	b	c	d
1	1	2	2
2	2	4	4
3	3	2	2
4	4	4	4
drop table t1;
drop table if exists t1, t2, t3;
create table t1(a int, b int, c int, d int, primary key(a,b,c));
insert into t1(a,b,c) values (1,1,1),(2,2,2),(3,3,3);
update t1 set d=1 where (a,b,c) in ((1,1,1),(2,2,2),(3,3,3));
select * from t1;
a	b	c	d
1	1	1	1
2	2	2	1
3	3	3	1
create table t2(a varchar(1024), b varchar(1024), c varchar(1024), d varchar(1024), primary key(a,b,c));
insert into t2(a,b,c) values ('a','a','a'),('b','b','b'),('c','c','c');
update t2 set d='a' where (a,b,c) in (('a','a','a'),('b','b','b'),('c','c','c'),('d','d','d'));
select * from t2;
a	b	c	d
a	a	a	a
b	b	b	a
c	c	c	a
update t2 set d='b' where (a,b,c) in (('a','a','a'),('b','b',''),('c','c','c')) and d in ('a','b');
select * from t2;
a	b	c	d
a	a	a	b
b	b	b	a
c	c	c	b
create table t3(a int, b varchar(1024), c  timestamp(6) default "2012-01-01 12:00:00", d int, primary key(a,b,c));
insert into t3(a,b,c) values (1,'a','2014-02-17'),(2,'b','2014-02-17'),(3,'c','2014-02-18');
update t3 set d=1 where (a,b,c) in ((1,'a','2014-02-17 00:00:00'),(2,'b','2014-02-17'));
select * from t3;
a	b	c	d
1	a	2014-02-17 00:00:00.000000	1
2	b	2014-02-17 00:00:00.000000	1
3	c	2014-02-18 00:00:00.000000	NULL
drop table if exists t1, t2, t3;
