drop table if exists t1;
create table t1 (a int, b int, c int, primary key (a, b));
insert into t1(a,b,c) values(1,1,1),(2,2,2),(3,3,3),(4,4,4);
select * from t1;
a	b	c
1	1	1
2	2	2
3	3	3
4	4	4
update t1 set b=2 where a>0 limit 1;
select * from t1;
a	b	c
1	2	1
2	2	2
3	3	3
4	4	4
update t1 set b=11 where a>0 limit 1,1;
select * from t1;
a	b	c
1	2	1
2	11	2
3	3	3
4	4	4
update t1 set b=2 where a>0 limit 2;
select * from t1;
a	b	c
1	2	1
2	2	2
3	3	3
4	4	4
update t1 set b=21 where a>0 limit 2,1;
select * from t1;
a	b	c
1	2	1
2	2	2
3	21	3
4	4	4
update t1 set b='30' where a>0 limit 0,3;
select * from t1;
a	b	c
1	30	1
2	30	2
3	30	3
4	4	4
update t1 set b=2 where a>0 limit 3;
select * from t1;
a	b	c
1	2	1
2	2	2
3	2	3
4	4	4
update t1 set b=2 where a>0 limit 4;
select * from t1;
a	b	c
1	2	1
2	2	2
3	2	3
4	2	4
update t1 set b=10 where a>0 limit 10;
select * from t1;
a	b	c
1	10	1
2	10	2
3	10	3
4	10	4
delete from t1 where a>0 limit 10;
select * from t1;
a	b	c
delete from t1 where a>0 limit 1000;
select * from t1;
a	b	c
delete from t1 where a>0 limit 0,1000;
insert into t1(a,b,c) values(1,1,1),(2,2,2),(3,3,3),(4,4,4);
select * from t1;
a	b	c
1	1	1
2	2	2
3	3	3
4	4	4
update t1 set b=2 where a>0 order by a desc limit 1;
select * from t1;
a	b	c
1	1	1
2	2	2
3	3	3
4	2	4
update t1 test set test.b=2 where test.a>0 order by test.a desc limit 2;
select * from t1;
a	b	c
1	1	1
2	2	2
3	2	3
4	2	4
update t1 set b=2 where a>0 order by a desc limit 0,3;
select * from t1;
a	b	c
1	1	1
2	2	2
3	2	3
4	2	4
update t1 set b=2 where a>0 order by a desc limit 4;
select * from t1;
a	b	c
1	2	1
2	2	2
3	2	3
4	2	4
delete from t1 where a>0 order by a limit 1;
select * from t1;
a	b	c
2	2	2
3	2	3
4	2	4
delete from t1 where a>0 order by a limit 1;
select * from t1;
a	b	c
3	2	3
4	2	4
delete from t1 where a>0 order by a limit 1;
select * from t1;
a	b	c
4	2	4
delete from t1 where a>0 order by a limit 1;
select * from t1;
a	b	c
delete from t1 where a>0 order by a limit 1;
select * from t1;
a	b	c
insert into t1(a,b,c) values(1,1,1),(2,2,2),(3,3,3),(4,4,4);
select * from t1;
a	b	c
1	1	1
2	2	2
3	3	3
4	4	4
delete from t1 where a>0 order by a desc limit -1;
ERROR 42000: You have an error in your SQL syntax; check the manual that corresponds to your OceanBase version for the right syntax to use near '-1' at line 1
delete from t1 where a>0 order by a desc limit 1;
select * from t1;
a	b	c
1	1	1
2	2	2
3	3	3
delete from t1 where a>0 order by a desc limit 1;
select * from t1;
a	b	c
1	1	1
2	2	2
delete from t1 where a>0 order by a desc limit 1;
select * from t1;
a	b	c
1	1	1
delete from t1 where a>0 order by a desc limit 1;
select * from t1;
a	b	c
delete from t1 where a>0 order by a desc limit null;
ERROR 42000: You have an error in your SQL syntax; check the manual that corresponds to your OceanBase version for the right syntax to use near 'null' at line 1
select * from t1;
a	b	c
